{
  "schemaVersion": 1,
  "templateId": "phandalin-starter",
  "version": "1.2.0",
  "system": "dnd_srd_5_2_1",
  "difficulty": "starter",
  "tags": [
    "starter",
    "frontier",
    "family",
    "dnd",
    "sessions"
  ],
  "stats": {
    "entities": 134,
    "relations": 145,
    "facts": 20,
    "preparedSessions": 8
  },
  "entities": [
    {
      "entityId": "ent_tpl_phandalin_note",
      "entityType": "note",
      "importance": "high",
      "visibility": {
        "kind": "dm_only"
      },
      "metadata": {
        "previewRole": "guide"
      }
    },
    {
      "entityId": "ent_tpl_phandalin_town",
      "entityType": "location",
      "importance": "critical",
      "visibility": {
        "kind": "party"
      },
      "metadata": {
        "regionKey": "sword_coast_frontier"
      }
    },
    {
      "entityId": "ent_tpl_phandalin_trail",
      "entityType": "location",
      "importance": "high",
      "visibility": {
        "kind": "party"
      },
      "metadata": {
        "type": "route"
      }
    },
    {
      "entityId": "ent_tpl_phandalin_hideout",
      "entityType": "location",
      "importance": "high",
      "visibility": {
        "kind": "dm_only"
      },
      "metadata": {
        "type": "dungeon"
      }
    },
    {
      "entityId": "ent_tpl_phandalin_tresendar",
      "entityType": "location",
      "importance": "critical",
      "visibility": {
        "kind": "party"
      },
      "metadata": {
        "type": "urban_dungeon"
      }
    },
    {
      "entityId": "ent_tpl_phandalin_wave_echo",
      "entityType": "location",
      "importance": "critical",
      "visibility": {
        "kind": "dm_only"
      },
      "metadata": {
        "type": "final dungeon"
      }
    },
    {
      "entityId": "ent_tpl_phandalin_gundren",
      "entityType": "npc",
      "importance": "critical",
      "visibility": {
        "kind": "party"
      },
      "metadata": {
        "roleKey": "opening_patron",
        "desireKey": "recover_family_mine"
      }
    },
    {
      "entityId": "ent_tpl_phandalin_sildar",
      "entityType": "npc",
      "importance": "high",
      "visibility": {
        "kind": "party"
      },
      "metadata": {
        "roleKey": "campaign_mentor"
      }
    },
    {
      "entityId": "ent_tpl_phandalin_redbrands",
      "entityType": "faction",
      "importance": "critical",
      "visibility": {
        "kind": "party"
      },
      "metadata": {
        "agendaKey": "maintain_social_control"
      }
    },
    {
      "entityId": "ent_tpl_phandalin_iarno",
      "entityType": "npc",
      "importance": "critical",
      "visibility": {
        "kind": "dm_only"
      },
      "metadata": {
        "publicMask": "mago perdido",
        "secretIdentity": "Glasstaff"
      }
    },
    {
      "entityId": "ent_tpl_phandalin_nezznar",
      "entityType": "npc",
      "importance": "critical",
      "visibility": {
        "kind": "dm_only"
      },
      "metadata": {
        "role": "antagonista final"
      }
    },
    {
      "entityId": "ent_tpl_phandalin_quest_gundren",
      "entityType": "quest",
      "importance": "critical",
      "visibility": {
        "kind": "party"
      },
      "metadata": {
        "objectiveKey": "rescue_gundren_and_recover_map"
      }
    },
    {
      "entityId": "ent_tpl_phandalin_clue_dead_horses",
      "entityType": "clue",
      "importance": "high",
      "visibility": {
        "kind": "dm_only"
      },
      "metadata": {
        "delivery": "escena inicial",
        "pointsTo": "ent_tpl_phandalin_hideout"
      }
    },
    {
      "entityId": "ent_tpl_phandalin_secret_iarno",
      "entityType": "secret",
      "importance": "critical",
      "visibility": {
        "kind": "dm_only"
      },
      "metadata": {
        "anchorClueIds": [
          "ent_tpl_phandalin_tresendar"
        ],
        "revealImpact": "cambia la confianza en los aliados adultos"
      }
    },
    {
      "entityId": "ent_tpl_phandalin_consequence_town",
      "entityType": "consequence",
      "importance": "high",
      "visibility": {
        "kind": "dm_only"
      },
      "metadata": {
        "trigger": "derrotar o exponer a los Redbrands"
      }
    },
    {
      "entityId": "ent_tpl_phandalin_inn",
      "entityType": "location",
      "importance": "normal",
      "visibility": {
        "kind": "party"
      }
    },
    {
      "entityId": "ent_tpl_phandalin_shrine",
      "entityType": "location",
      "importance": "normal",
      "visibility": {
        "kind": "party"
      }
    },
    {
      "entityId": "ent_tpl_phandalin_toblen",
      "entityType": "npc",
      "importance": "normal",
      "visibility": {
        "kind": "party"
      }
    },
    {
      "entityId": "ent_tpl_phandalin_linene",
      "entityType": "npc",
      "importance": "normal",
      "visibility": {
        "kind": "party"
      }
    },
    {
      "entityId": "ent_tpl_phandalin_halia",
      "entityType": "npc",
      "importance": "high",
      "visibility": {
        "kind": "dm_only"
      }
    },
    {
      "entityId": "ent_tpl_phandalin_qelline",
      "entityType": "npc",
      "importance": "normal",
      "visibility": {
        "kind": "party"
      }
    },
    {
      "entityId": "ent_tpl_phandalin_quest_break_fear",
      "entityType": "quest",
      "importance": "high",
      "visibility": {
        "kind": "party"
      }
    },
    {
      "entityId": "ent_tpl_phandalin_clue_blackseal",
      "entityType": "clue",
      "importance": "high",
      "visibility": {
        "kind": "dm_only"
      }
    },
    {
      "entityId": "ent_tpl_phandalin_clue_redclay",
      "entityType": "clue",
      "importance": "normal",
      "visibility": {
        "kind": "dm_only"
      }
    },
    {
      "entityId": "ent_tpl_phandalin_rumor_well",
      "entityType": "rumor",
      "importance": "low",
      "visibility": {
        "kind": "party"
      }
    },
    {
      "entityId": "ent_tpl_phandalin_handout_map",
      "entityType": "handout",
      "importance": "critical",
      "visibility": {
        "kind": "party"
      }
    },
    {
      "entityId": "ent_tpl_phandalin_encounter_street",
      "entityType": "encounter",
      "importance": "normal",
      "visibility": {
        "kind": "dm_only"
      }
    },
    {
      "entityId": "ent_tpl_phandalin_consequence_people_rise",
      "entityType": "consequence",
      "importance": "high",
      "visibility": {
        "kind": "dm_only"
      }
    },
    {
      "entityId": "ent_tpl_phandalin_secret_nezznar_funds",
      "entityType": "secret",
      "importance": "high",
      "visibility": {
        "kind": "dm_only"
      }
    },
    {
      "entityId": "ent_tpl_phandalin_pc_aric",
      "entityType": "player_character",
      "importance": "normal",
      "visibility": {
        "kind": "party"
      },
      "status": "active",
      "metadata": {
        "isPremade": true,
        "className": "Guerrero",
        "level": 1,
        "species": "Humano",
        "background": "Soldado",
        "armorClass": 17,
        "hitPointsMax": 12,
        "hitPointsCurrent": 12,
        "hitDice": "1d10",
        "speed": 30,
        "initiative": 1,
        "passivePerception": 13,
        "passiveInsight": 11,
        "passiveInvestigation": 10,
        "strength": 16,
        "dexterity": 12,
        "constitution": 15,
        "intelligence": 10,
        "wisdom": 13,
        "charisma": 10,
        "skills": [
          "athletics",
          "perception",
          "intimidation"
        ]
      }
    },
    {
      "entityId": "ent_tpl_phandalin_pc_mira",
      "entityType": "player_character",
      "importance": "normal",
      "visibility": {
        "kind": "party"
      },
      "status": "active",
      "metadata": {
        "isPremade": true,
        "className": "Pícara",
        "level": 1,
        "species": "Mediana",
        "background": "Criminal reformada",
        "armorClass": 14,
        "hitPointsMax": 8,
        "hitPointsCurrent": 8,
        "hitDice": "1d8",
        "speed": 25,
        "initiative": 3,
        "passivePerception": 14,
        "passiveInsight": 12,
        "passiveInvestigation": 13,
        "strength": 8,
        "dexterity": 17,
        "constitution": 12,
        "intelligence": 13,
        "wisdom": 14,
        "charisma": 11,
        "skills": [
          "stealth",
          "sleight_of_hand",
          "perception",
          "deception"
        ]
      }
    },
    {
      "entityId": "ent_tpl_phandalin_pc_brom",
      "entityType": "player_character",
      "importance": "normal",
      "visibility": {
        "kind": "party"
      },
      "status": "active",
      "metadata": {
        "isPremade": true,
        "className": "Clérigo",
        "level": 1,
        "species": "Enano",
        "background": "Artesano gremial",
        "armorClass": 16,
        "hitPointsMax": 10,
        "hitPointsCurrent": 10,
        "hitDice": "1d8",
        "speed": 25,
        "initiative": 0,
        "passivePerception": 15,
        "passiveInsight": 15,
        "passiveInvestigation": 10,
        "strength": 14,
        "dexterity": 10,
        "constitution": 15,
        "intelligence": 10,
        "wisdom": 16,
        "charisma": 12,
        "skills": [
          "medicine",
          "insight",
          "religion",
          "history"
        ]
      }
    },
    {
      "entityId": "ent_tpl_phandalin_pc_nim",
      "entityType": "player_character",
      "importance": "normal",
      "visibility": {
        "kind": "party"
      },
      "status": "active",
      "metadata": {
        "isPremade": true,
        "className": "Maga",
        "level": 1,
        "species": "Elfa",
        "background": "Sabia",
        "armorClass": 12,
        "hitPointsMax": 6,
        "hitPointsCurrent": 6,
        "hitDice": "1d6",
        "speed": 30,
        "initiative": 2,